{
  "schema_version": "1.0",
  "stage": "triage",
  "run_id": "fixture",
  "generated_at": "2026-08-11T07:02:19Z",
  "agent": { "model": "gpt-5-codex", "charter_sha": "fixture", "attempt": 1 },
  "kept": [
    {
      "story_id": "st_night_vote",
      "domains": ["knesset", "budget", "coalition"],
      "figures": [
        {
          "name_he": "רותי בן-שחר",
          "name_en": "Ruti Ben-Shahar",
          "role": "Chair, Finance Committee",
          "public_figure": true,
          "basis": "Elected member chairing a Knesset committee; the conduct at issue is her convening and running of a public sitting."
        }
      ],
      "censor_risk": "none",
      "sub_judice": false,
      "salience": 8.5,
      "rationale": "Three outlets across the spectrum within six hours, very high talkback volume, and a procedural dispute with named participants disputing the facts on the record."
    },
    {
      "story_id": "st_recycled_renders",
      "domains": ["budget", "local_government"],
      "figures": [
        {
          "name_he": "אבנר גלעד",
          "name_en": "Avner Gilad",
          "role": "Minister of Transport and Housing",
          "public_figure": true,
          "basis": "Serving minister; the conduct at issue is an official ministry presentation he fronted."
        }
      ],
      "censor_risk": "none",
      "sub_judice": false,
      "salience": 6.0,
      "rationale": "Narrower breadth and lower engagement, but a self-contained and easily grasped embarrassment with a clear physical artefact at its centre."
    }
  ],
  "dropped": []
}
